{
  "meta": {
    "schema_version": "0.4.1",
    "esaa_version": "0.4.x",
    "immutable_done": true,
    "master_correlation_id": null,
    "run": {
      "run_id": null,
      "status": "initialized",
      "last_event_seq": 3,
      "projection_hash_sha256": "411885afdc5e0e74e1eac70f8cef0094ef6842c1b5c11b34654bb1e3b0664d50",
      "verify_status": "ok"
    },
    "updated_at": "2026-06-11T02:53:05Z"
  },
  "project": {
    "name": "esaa-core",
    "audit_scope": ".roadmap/"
  },
  "tasks": [],
  "indexes": {
    "by_status": {},
    "by_kind": {}
  }
}
