{
  "meta": {
    "schema_version": "0.4.1",
    "esaa_version": "0.4.x",
    "immutable_done": true,
    "master_correlation_id": "CID-ESAA-OPT",
    "run": {"run_id": null, "status": "initialized", "last_event_seq": 0,
             "projection_hash_sha256": "0000000000000000000000000000000000000000000000000000000000000000",
             "verify_status": "unknown"},
    "updated_at": "2026-05-23T09:00:00Z"
  },
  "project": {"name": "esaa-optimizing", "audit_scope": "src/esaa/ + tests/ + docs/"},
  "tasks": [
    {"task_id":"OPT-1600","task_kind":"spec","title":"Parallel dispatch: consumir parallel_groups em run","description":"Especificar como run() consome o primeiro parallel_group e despacha N agentes via ThreadPoolExecutor; orchestrator continua single-writer.","status":"todo","depends_on":[],"targets":["opt-parallel"],"outputs":{"files":["docs/spec/OPT-1600.md"]},"immutability":{"done_is_immutable":true}},
    {"task_id":"OPT-1601","task_kind":"impl","title":"Parallel dispatch: implementar","description":"service.run aceita parallel=N; CLI run aceita --parallel.","status":"todo","depends_on":["OPT-1600"],"targets":["opt-parallel"],"outputs":{"files":["src/esaa/service.py","src/esaa/cli.py"]},"immutability":{"done_is_immutable":true}},
    {"task_id":"OPT-1602","task_kind":"qa","title":"Parallel dispatch: teste de wave concorrente","description":"Verifica que N tasks elegiveis sao despachadas em paralelo (timing).","status":"todo","depends_on":["OPT-1601"],"targets":["opt-parallel"],"outputs":{"files":["tests/test_parallel_dispatch.py"]},"immutability":{"done_is_immutable":true}},

    {"task_id":"OPT-1610","task_kind":"spec","title":"Metricas estruturadas","description":"Definir o conjunto: events_by_action, output_rejected_by_code, tasks_done/total, attempts_total, run_status.","status":"todo","depends_on":[],"targets":["opt-metrics"],"outputs":{"files":["docs/spec/OPT-1610.md"]},"immutability":{"done_is_immutable":true}},
    {"task_id":"OPT-1611","task_kind":"impl","title":"Metricas: modulo + CLI","description":"src/esaa/metrics.py com compute_metrics(events); esaa metrics CLI emite JSON.","status":"todo","depends_on":["OPT-1610"],"targets":["opt-metrics"],"outputs":{"files":["src/esaa/metrics.py","src/esaa/cli.py"]},"immutability":{"done_is_immutable":true}},
    {"task_id":"OPT-1612","task_kind":"qa","title":"Metricas: testes unitarios","description":"Confere contagens por action; deteccao de rejection rate por error_code.","status":"todo","depends_on":["OPT-1611"],"targets":["opt-metrics"],"outputs":{"files":["tests/test_metrics.py"]},"immutability":{"done_is_immutable":true}},

    {"task_id":"OPT-1620","task_kind":"spec","title":"Adapter LLM real (HTTP generico)","description":"Adapter que faz POST do dispatch_context para um endpoint configuravel (ESAA_LLM_URL) e retorna a resposta como agent_result.","status":"todo","depends_on":[],"targets":["opt-llm"],"outputs":{"files":["docs/spec/OPT-1620.md"]},"immutability":{"done_is_immutable":true}},
    {"task_id":"OPT-1621","task_kind":"impl","title":"HttpLlmAdapter","description":"src/esaa/adapters/http_llm.py implementa AgentAdapter via urllib; auth por header opcional.","status":"todo","depends_on":["OPT-1620"],"targets":["opt-llm"],"outputs":{"files":["src/esaa/adapters/http_llm.py","src/esaa/adapters/__init__.py"]},"immutability":{"done_is_immutable":true}},
    {"task_id":"OPT-1622","task_kind":"qa","title":"HttpLlmAdapter: teste end-to-end com fake server","description":"Sobe http.server local; service.run dispacha pelo adapter; verifica claim->complete cycle.","status":"todo","depends_on":["OPT-1621"],"targets":["opt-llm"],"outputs":{"files":["tests/test_http_llm_adapter.py"]},"immutability":{"done_is_immutable":true}},

    {"task_id":"OPT-1630","task_kind":"spec","title":"Hotfix CI scenario","description":"Cenario: agente emite issue.report -> orchestrator cria hotfix -> claim/complete(2 checks)/review -> issue.resolve.","status":"todo","depends_on":[],"targets":["opt-hotfix"],"outputs":{"files":["docs/spec/OPT-1630.md"]},"immutability":{"done_is_immutable":true}},
    {"task_id":"OPT-1631","task_kind":"impl","title":"Teste de lifecycle de hotfix","description":"tests/test_hotfix_lifecycle.py exercita o caminho completo.","status":"todo","depends_on":["OPT-1630"],"targets":["opt-hotfix"],"outputs":{"files":["tests/test_hotfix_lifecycle.py"]},"immutability":{"done_is_immutable":true}},
    {"task_id":"OPT-1632","task_kind":"qa","title":"Hotfix CI: registro de evidencia","description":"Documenta o cenario coberto.","status":"todo","depends_on":["OPT-1631"],"targets":["opt-hotfix"],"outputs":{"files":["docs/qa/OPT-1632.md"]},"immutability":{"done_is_immutable":true}},

    {"task_id":"OPT-1640","task_kind":"spec","title":"Snapshot/checkpoint do event store","description":"esaa snapshot --before <seq> grava .roadmap/snapshots/seq-<N>.json com a projecao naquele ponto.","status":"todo","depends_on":[],"targets":["opt-snapshot"],"outputs":{"files":["docs/spec/OPT-1640.md"]},"immutability":{"done_is_immutable":true}},
    {"task_id":"OPT-1641","task_kind":"impl","title":"Snapshot: modulo + CLI","description":"src/esaa/snapshot.py + esaa snapshot CLI.","status":"todo","depends_on":["OPT-1640"],"targets":["opt-snapshot"],"outputs":{"files":["src/esaa/snapshot.py","src/esaa/cli.py"]},"immutability":{"done_is_immutable":true}},
    {"task_id":"OPT-1642","task_kind":"qa","title":"Snapshot: testes","description":"Confere conteudo + estabilidade do hash.","status":"todo","depends_on":["OPT-1641"],"targets":["opt-snapshot"],"outputs":{"files":["tests/test_snapshot.py"]},"immutability":{"done_is_immutable":true}},

    {"task_id":"OPT-1650","task_kind":"spec","title":"Lock multi-processo no append","description":"Lock file-based atomico (O_CREAT|O_EXCL) com retry/timeout; protege append_events em multi-processo.","status":"todo","depends_on":[],"targets":["opt-lock"],"outputs":{"files":["docs/spec/OPT-1650.md"]},"immutability":{"done_is_immutable":true}},
    {"task_id":"OPT-1651","task_kind":"impl","title":"Lock: store.append_events com lock","description":"src/esaa/store.py com _acquire_store_lock/_release_store_lock cross-platform.","status":"todo","depends_on":["OPT-1650"],"targets":["opt-lock"],"outputs":{"files":["src/esaa/store.py"]},"immutability":{"done_is_immutable":true}},
    {"task_id":"OPT-1652","task_kind":"qa","title":"Lock: testes de concorrencia","description":"Spawn de subprocesso que segura o lock; verifica timeout/retry.","status":"todo","depends_on":["OPT-1651"],"targets":["opt-lock"],"outputs":{"files":["tests/test_store_lock.py"]},"immutability":{"done_is_immutable":true}}
  ],
  "indexes": {"by_status": {"todo": 18}, "by_kind": {"spec": 6, "impl": 6, "qa": 6}}
}
